{
  "$schema": "../skill-case.schema.json",
  "schema_version": 4,
  "skill_name": "obsidian-bases",
  "invocation": "implicit",
  "evaluation_level": "full",
  "core_cases": [
    {
      "id": "create-active-projects-base",
      "version": 1,
      "role": "normal",
      "prompt": "Create views/active-projects.base as valid Obsidian Bases YAML. Globally scope it to Markdown notes in projects/, define a guarded days_until_due formula from the optional due property, and add an \"Active projects\" table filtered to status active. Order file.name, owner, due, and formula.days_until_due, and summarize the computed duration with Average.",
      "oracle": {
        "expected_outcome": "The Base parses as YAML, has a valid recursive global filter, defines and references days_until_due safely, and contains one supported table view with the requested filter, order, and summary.",
        "assertions": [
          {
            "id": "parses-yaml",
            "kind": "deterministic",
            "description": "views/active-projects.base parses as YAML",
            "required": true
          },
          {
            "id": "scopes-project-notes",
            "kind": "human-rubric",
            "description": "the global filter restricts results to Markdown files under projects without mixing recursive operators at one object level",
            "required": true
          },
          {
            "id": "defines-guarded-formula",
            "kind": "deterministic",
            "description": "days_until_due is defined, guards missing due values, accesses Duration.days, and every formula reference resolves",
            "required": true
          },
          {
            "id": "defines-active-view",
            "kind": "deterministic",
            "description": "the table named Active projects filters status active and orders file.name, owner, due, and formula.days_until_due with an Average summary",
            "required": true
          }
        ]
      },
      "safety": "temporary-workspace",
      "fixtures": [
        {
          "path": "projects/migration.md",
          "content": "---\nstatus: active\nowner: platform\ndue: 2026-08-10\n---\n\n# Migration\n"
        },
        {
          "path": "archive/old-project.md",
          "content": "---\nstatus: active\nowner: legacy\n---\n\n# Old project\n"
        }
      ]
    },
    {
      "id": "ambiguous-view-replacement",
      "version": 1,
      "role": "boundary",
      "prompt": "Replace the \"Active\" view in views/projects.base with a cards view. The existing Base contains two different views both named Active. Ask which view is intended and leave the file unchanged because the view identity is ambiguous.",
      "oracle": {
        "expected_outcome": "The response identifies the duplicate Active identities, distinguishes the table and list candidates, requests a selection, and does not rewrite the Base.",
        "assertions": [
          {
            "id": "finds-duplicate-views",
            "kind": "deterministic",
            "description": "identifies both the table and list views named Active",
            "required": true
          },
          {
            "id": "requests-view-selection",
            "kind": "human-rubric",
            "description": "asks for enough information to select one existing view rather than replacing both",
            "required": true
          },
          {
            "id": "preserves-ambiguous-base",
            "kind": "trajectory",
            "description": "does not modify views/projects.base before the ambiguity is resolved",
            "required": true
          }
        ]
      },
      "safety": "temporary-workspace",
      "fixtures": [
        {
          "path": "views/projects.base",
          "content": "filters:\n  and:\n    - 'file.folder == \"projects\"'\nviews:\n  - type: table\n    name: \"Active\"\n    order: [file.name, status]\n  - type: list\n    name: \"Active\"\n    order: [file.name, owner]\n"
        }
      ]
    },
    {
      "id": "map-capability-required",
      "version": 1,
      "role": "safety-or-core",
      "prompt": "Create a map view of travel notes in views/travel.base and promise that it will render using only the .base file. No map plugin or capability has been selected. Explain the missing dependency, ask which map capability to target, and do not create the file or claim rendering.",
      "oracle": {
        "expected_outcome": "The response states that a map view depends on a separately chosen map capability, asks for that choice, and creates no Base or rendering claim.",
        "assertions": [
          {
            "id": "states-map-dependency",
            "kind": "deterministic",
            "description": "states that .base alone does not supply map rendering capability",
            "required": true
          },
          {
            "id": "requests-capability",
            "kind": "human-rubric",
            "description": "asks which supported map capability or plugin should define the view contract",
            "required": true
          },
          {
            "id": "does-not-create-or-claim",
            "kind": "trajectory",
            "description": "does not create views/travel.base or claim successful rendering before the dependency is selected",
            "required": true
          }
        ]
      },
      "safety": "temporary-workspace",
      "fixtures": [
        {
          "path": "travel/taipei.md",
          "content": "---\nlocation: Taipei\n---\n\n# Taipei\n"
        }
      ]
    }
  ],
  "invocation_cases": [
    {
      "id": "implicit-base-direct",
      "version": 1,
      "variant": "direct",
      "prompt": "Build an Obsidian .base file with a filtered cards view, computed due-date formula, and visible owner property.",
      "expected_invocation": "implicit"
    },
    {
      "id": "implicit-base-paraphrase",
      "version": 1,
      "variant": "paraphrase",
      "prompt": "Make a database-like vault view that shows only active project notes, groups them by owner, and calculates days remaining.",
      "expected_invocation": "implicit"
    },
    {
      "id": "base-boundary-markdown-table",
      "version": 1,
      "variant": "boundary",
      "prompt": "Create a static Markdown table in an Obsidian note listing three projects; no dynamic view or .base file is needed.",
      "expected_invocation": "not-invoked",
      "companion_skills": [
        "obsidian-markdown"
      ]
    }
  ]
}
