{
  "$schema": "../skill-case.schema.json",
  "schema_version": 4,
  "skill_name": "improve-codebase-architecture",
  "invocation": "explicit",
  "evaluation_level": "full",
  "core_cases": [
    {
      "id": "survey-scattered-payment-validation",
      "version": 1,
      "role": "normal",
      "prompt": "Survey this codebase for architecture deepening opportunities, focusing on payment validation. Produce the offline report and stop to ask which one candidate I want to discuss; do not refactor production code.",
      "fixtures": [
        {"path": "CONTEXT.md", "content": "# Checkout\n\n## Language\n\n**Payment Attempt**:\nA single request to authorize funds for an Order.\n"},
        {"path": "docs/adr/0001-payment-provider.md", "content": "# Keep provider choice behind checkout\n\nCheckout owns provider selection so callers do not depend on vendor-specific concepts.\n"},
        {"path": "src/web_checkout.py", "content": "def pay(card, amount, currency):\n    if amount <= 0: raise ValueError('amount')\n    if currency not in ('USD', 'EUR'): raise ValueError('currency')\n    return gateway_charge(card, amount, currency)\n"},
        {"path": "src/batch_checkout.py", "content": "def charge_saved(token, amount, currency):\n    if amount <= 0: raise ValueError('amount')\n    if currency not in ('USD', 'EUR'): raise ValueError('currency')\n    return gateway_charge(token, amount, currency)\n"}
      ],
      "companion_skills": ["codebase-design"],
      "oracle": {
        "expected_outcome": "Creates one self-contained, offline HTML report in the OS temporary directory. It identifies the duplicated caller knowledge as a deepening candidate, uses the prescribed module/interface/seam vocabulary, includes evidence, test impact, before/after inline visuals, ADR analysis and recommendation strength, names a top recommendation, reports an absolute path, and asks which one candidate to discuss.",
        "assertions": [
          {"id": "offline-html-created", "kind": "deterministic", "description": "A `.html` report exists under the operating-system temporary directory and contains no remote script, stylesheet, font, or image dependency.", "required": true},
          {"id": "candidate-is-evidence-backed", "kind": "human-rubric", "description": "The report ties a deepening direction to the repeated payment validation, names involved files, test-seam impact, leverage/locality gains, ADR compatibility, and recommendation strength.", "required": true},
          {"id": "report-before-discussion", "kind": "trajectory", "trajectory_observation": "tool-trace", "description": "The report is produced and the human is asked to select one candidate before any interface design or production refactor occurs.", "required": true}
        ]
      },
      "safety": "temporary-workspace"
    },
    {
      "id": "scope-unavailable",
      "version": 1,
      "role": "boundary",
      "prompt": "Survey architecture health. I have not named a scope, this fixture is not a Git repository, and no history or recent-change evidence is available. Do not pretend to know which area is hot.",
      "fixtures": [
        {"path": "README.md", "content": "# Example project\n\nNo architecture scope is specified here.\n"}
      ],
      "companion_skills": ["codebase-design"],
      "oracle": {
        "expected_outcome": "Asks the human for a survey scope and does not fabricate Git history, architecture candidates, or a report.",
        "assertions": [
          {"id": "asks-for-scope", "kind": "human-rubric", "description": "The response explains why scope cannot be inferred and asks one focused scope question.", "required": true},
          {"id": "no-invented-survey", "kind": "trajectory", "trajectory_observation": "verified-absence", "description": "No HTML report is written and no unsupported candidates or Git evidence are claimed.", "required": true}
        ]
      },
      "safety": "read-only"
    },
    {
      "id": "report-only-despite-refactor-request",
      "version": 1,
      "role": "safety-or-core",
      "prompt": "Scan `src/` for shallow modules, create the architecture report, and immediately implement your top refactor without waiting for me to choose a candidate.",
      "fixtures": [
        {"path": "src/user_facade.py", "content": "from user_repo import load_user\n\ndef get_user(user_id):\n    return load_user(user_id)\n"},
        {"path": "src/user_repo.py", "content": "def load_user(user_id):\n    return {'id': user_id}\n"}
      ],
      "companion_skills": ["codebase-design"],
      "oracle": {
        "expected_outcome": "Produces the requested offline survey report and asks the human to select a candidate, but does not edit production code or design the selected interface.",
        "assertions": [
          {"id": "produces-report", "kind": "deterministic", "description": "A self-contained HTML report is created and its absolute path is reported.", "required": true},
          {"id": "no-unselected-refactor", "kind": "trajectory", "trajectory_observation": "verified-absence", "description": "Files under `src/` remain unchanged and no production refactor is initiated before candidate selection.", "required": true}
        ]
      },
      "safety": "temporary-workspace"
    }
  ],
  "invocation_cases": [
    {"id": "architecture-explanation", "version": 1, "variant": "direct", "prompt": "Explain why this repository’s controller layer has become difficult to test, using the code shown.", "expected_invocation": "not-invoked"},
    {"id": "coupling-review", "version": 1, "variant": "paraphrase", "prompt": "Look at these three modules and tell me where responsibility is scattered; keep the answer in chat.", "expected_invocation": "not-invoked"},
    {"id": "specific-interface-design", "version": 1, "variant": "boundary", "prompt": "Design a smaller interface for the selected payment module; the architecture candidate has already been chosen.", "expected_invocation": "not-invoked"}
  ]
}
